{
  "v": 1,
  "id": "mana-core-next-three-task-definition-medium",
  "goal": "Review the approved Mana Core design, ownership, completed asset gate, completed pure-Java storage slice, and current bounded source state. Propose exactly three next dependency-ordered implementation tasks for Devstral Small. Return valid JSON only, with top-level keys proposal_id and tasks. tasks must contain exactly three objects. Each object must include id, title, objective, depends_on, allowed_files, forbidden_files, constraints, client_server_considerations, acceptance_criteria, files_to_inspect, suggested_write_roots, suggested_verifiers, and rationale. Make every task independently bounded and verifiable, avoid duplicating the completed storage slice, keep all changes within Mod Engineer ownership, preserve pinned versions, and do not assume missing Gradle/Fabric infrastructure exists. Prefer the smallest coherent progression toward the approved MVP; explicitly account for prerequisites and current repository gaps.",
  "target": "initiatives/mc-mod-core",
  "model": {
    "profile": "mistral-medium-3.5",
    "capability": "planning",
    "importance": "high"
  },
  "context": [
    {"path": "AGENTS.md", "start": 39, "end": 105},
    {"path": "docs/PRODUCT.md", "start": 1, "end": 55},
    {"path": "docs/ARCHITECTURE.md", "start": 45, "end": 75},
    {"path": "mod-spec.json", "start": 1, "end": 63},
    {"path": ".mc-mod-agents/results/03c-mana-storage-devstral-tools.result.json", "start": 1, "end": 28}
  ],
  "write_roots": [
    ".mc-mod-agents/results/04-next-three-task-definition-medium.response.json"
  ],
  "done": [
    "The response is valid JSON with exactly three dependency-ordered Devstral implementation tasks.",
    "Each task follows the repository task specification and declares bounded Mod Engineer files and objective acceptance criteria.",
    "The proposal starts from the completed storage slice and does not claim unobserved build, client, server, or runtime evidence."
  ],
  "forbidden": [
    "Do not propose edits to approved design, asset, ownership, approval, agent-state, or pinned-version files.",
    "Do not duplicate the completed ChunkManaMap, ManaCoordinates, ManaMath, or ChunkManaMapTest implementation slice.",
    "Do not use network access, repository tools, subagents, MCP, downloads, or package installation.",
    "Do not output prose outside the required JSON object."
  ],
  "limits": {
    "packet_chars": 30000,
    "output_chars": 20000,
    "model_context_tokens": 65536,
    "model_output_tokens": 8192,
    "model_timeout_seconds": 600,
    "max_tool_calls": 1,
    "max_verifiers": 0,
    "verifier_timeout_seconds": 30
  },
  "verifiers": []
}
