{
  "v": 1,
  "id": "mana-core-mod-engineer-devstral-tools",
  "goal": "Implement the approved Fabric 26.2 Mana Core mod and its tests using the completed creative package. Work from the full target directory, make the smallest coherent implementation that satisfies the approved product, architecture, acceptance contract, and mod specification, and use only the permitted repository tools and verification commands.",
  "target": "initiatives/mc-mod-core",
  "model": {
    "profile": "devstral-small",
    "capability": "coding",
    "importance": "high"
  },
  "context": [
    {
      "path": "AGENTS.md",
      "start": 1,
      "end": 10000000
    },
    {
      "path": ".mc-mod-agents/context/roles/mod-engineer.md",
      "start": 1,
      "end": 10000000
    },
    {
      "path": "docs/PRODUCT.md",
      "start": 1,
      "end": 10000000
    },
    {
      "path": "docs/ARCHITECTURE.md",
      "start": 1,
      "end": 10000000
    },
    {
      "path": "docs/ACCEPTANCE.md",
      "start": 1,
      "end": 10000000
    },
    {
      "path": "mod-spec.json",
      "start": 1,
      "end": 10000000
    },
    {
      "path": "docs/style-guide.md",
      "start": 1,
      "end": 10000000
    },
    {
      "path": "assets/asset-manifest.json",
      "start": 1,
      "end": 10000000
    }
  ],
  "write_roots": [
    "docs/IMPLEMENTATION.md",
    "build.gradle",
    "settings.gradle",
    "gradle.properties",
    "gradlew",
    "gradlew.bat",
    "gradle/wrapper",
    "src/main/resources/fabric.mod.json",
    "src/main/java",
    "src/client/java",
    "src/test/java"
  ],
  "done": [
    "Every declared engineering artifact exists as an individual file.",
    "The implementation preserves common/client source-set isolation and server authority.",
    "docs/IMPLEMENTATION.md maps behavior and tests to the approved acceptance contract.",
    "All four trusted Gradle verifiers pass."
  ],
  "forbidden": [
    "Do not edit approved design files, creative files, mod-spec.json, or agent state.",
    "Do not read or write outside initiatives/mc-mod-core.",
    "Do not use network access, package installation, downloads, Forge APIs, NeoForge APIs, or unjustified mixins.",
    "Do not spawn subagents or use MCP tools."
  ],
  "limits": {
    "packet_chars": 200000,
    "output_chars": 16000,
    "model_context_tokens": 200000,
    "model_output_tokens": 200000,
    "model_timeout_seconds": 3600,
    "max_tool_calls": 80,
    "max_verifiers": 4,
    "verifier_timeout_seconds": 900
  },
  "verifiers": [
    {
      "id": "compile-common",
      "argv": ["{python}", ".mc-mod-agents/tools/run_gradle.py", "compileJava"]
    },
    {
      "id": "compile-client",
      "argv": ["{python}", ".mc-mod-agents/tools/run_gradle.py", "compileClientJava"]
    },
    {
      "id": "unit-tests",
      "argv": ["{python}", ".mc-mod-agents/tools/run_gradle.py", "test"]
    },
    {
      "id": "build",
      "argv": ["{python}", ".mc-mod-agents/tools/run_gradle.py", "build"]
    }
  ]
}
