{
  "v": 1,
  "id": "mana-core-gradient-calculator-devstral",
  "goal": "Implement the next bounded pure-Java slice. Add GradientCalculator with public static calculate(ChunkManaMap map, int ax, int ay, int az, int bx, int by, int bz), returning a nested public Gradient record with dx, dy, dz, and magnitude. Direction components are -1, 0, or 1 and point from the coordinate with higher mana to the one with lower mana. Magnitude is the absolute mana difference. Equal mana returns the zero gradient. Add a no-dependency executable GradientCalculatorTest main class.",
  "target": "initiatives/mc-mod-core",
  "model": {
    "profile": "devstral-small",
    "capability": "coding",
    "importance": "high"
  },
  "context": [
    {"path": "AGENTS.md", "start": 39, "end": 105},
    {"path": "docs/PRODUCT.md", "start": 1, "end": 55},
    {"path": "docs/ARCHITECTURE.md", "start": 150, "end": 225},
    {"path": ".mc-mod-agents/results/03c-mana-storage-devstral-tools.result.json", "start": 1, "end": 28},
    {"path": "src/main/java/com/manacore/core/storage/ChunkManaMap.java", "start": 1, "end": 213},
    {"path": "src/main/java/com/manacore/core/storage/ManaCoordinates.java", "start": 1, "end": 176},
    {"path": "src/main/java/com/manacore/core/ManaMath.java", "start": 1, "end": 212}
  ],
  "write_roots": [
    "src/main/java/com/manacore/core/flow/GradientCalculator.java",
    "src/test/java/com/manacore/core/flow/GradientCalculatorTest.java"
  ],
  "done": [
    "The exact calculate API and nested immutable Gradient record compile on Java 25 without Minecraft or Fabric dependencies.",
    "Direction points from higher mana to lower mana regardless of argument order; magnitude is the finite non-negative absolute difference; equal values produce a zero gradient.",
    "GradientCalculatorTest is an executable no-dependency main test covering axis, diagonal, reversed arguments, equal values, sparse values, and negative coordinates.",
    "The root-authored gradient contract verifier passes."
  ],
  "forbidden": [
    "Do not write outside the two exact declared files.",
    "Do not modify the completed storage slice, design, assets, build files, pins, or agent state.",
    "Do not use Minecraft, Fabric, client, networking, persistence, file I/O, network, subagent, MCP, package-manager, or download APIs.",
    "Do not add world-bound exceptions; coordinates are Java ints."
  ],
  "limits": {
    "packet_chars": 60000,
    "output_chars": 12000,
    "model_context_tokens": 200000,
    "model_output_tokens": 200000,
    "model_timeout_seconds": 900,
    "max_tool_calls": 24,
    "max_verifiers": 1,
    "verifier_timeout_seconds": 120
  },
  "verifiers": [
    {
      "id": "pure-java-gradient-contract",
      "argv": ["{python}", ".mc-mod-agents/tools/verify_gradient_slice.py"]
    }
  ]
}
