{
  "v": 1,
  "id": "mana-core-flow-engine-devstral",
  "goal": "Implement bounded pure-Java mana flow. Add FlowEngine.flowPair(ChunkManaMap map, int ax, int ay, int az, int bx, int by, int bz, double maxTransfer), returning the amount moved from higher mana to lower mana. It must use GradientCalculator, move min(maxTransfer, gradient magnitude / 2), conserve mana, and return zero for equal mana or invalid/non-positive maxTransfer. Add a public nested Edge record and flowAll(ChunkManaMap map, Iterable<Edge> edges, double maxTransferPerEdge), which processes explicit edges in iteration order and returns total moved. Add an executable no-dependency FlowEngineTest main class.",
  "target": "initiatives/mc-mod-core",
  "model": {
    "profile": "devstral-small",
    "capability": "coding",
    "importance": "high"
  },
  "context": [
    {"path": "AGENTS.md", "start": 39, "end": 105},
    {"path": "docs/PRODUCT.md", "start": 1, "end": 55},
    {"path": "docs/ARCHITECTURE.md", "start": 150, "end": 225},
    {"path": ".mc-mod-agents/results/06-gradient-calculator-devstral.result.json", "start": 1, "end": 23},
    {"path": "src/main/java/com/manacore/core/storage/ChunkManaMap.java", "start": 1, "end": 213},
    {"path": "src/main/java/com/manacore/core/ManaMath.java", "start": 1, "end": 212},
    {"path": "src/main/java/com/manacore/core/flow/GradientCalculator.java", "start": 1, "end": 130}
  ],
  "write_roots": [
    "src/main/java/com/manacore/core/flow/FlowEngine.java",
    "src/test/java/com/manacore/core/flow/FlowEngineTest.java"
  ],
  "done": [
    "The exact flowPair, flowAll, and Edge APIs compile on Java 25 without Minecraft or Fabric dependencies.",
    "Each pair transfer follows GradientCalculator from higher to lower, never overshoots equalization, respects the finite positive cap, and conserves total mana.",
    "flowAll consumes only its explicit bounded edge iterable, processes it deterministically on the caller's server tick thread, and returns the sum moved.",
    "FlowEngineTest and the root-authored flow contract pass."
  ],
  "forbidden": [
    "Do not write outside the two exact declared files.",
    "Do not modify completed storage or gradient slices, design, assets, build files, pins, or agent state.",
    "Do not enumerate private ChunkManaMap state or add concurrency, Minecraft, Fabric, client, networking, persistence, file I/O, network, subagent, MCP, package-manager, or download APIs.",
    "Do not invent world bounds or claim thread safety; execution is single-threaded in iterable order."
  ],
  "limits": {
    "packet_chars": 65000,
    "output_chars": 14000,
    "model_context_tokens": 200000,
    "model_output_tokens": 200000,
    "model_timeout_seconds": 900,
    "max_tool_calls": 24,
    "max_verifiers": 1,
    "verifier_timeout_seconds": 120
  },
  "verifiers": [
    {
      "id": "pure-java-flow-contract",
      "argv": ["{python}", ".mc-mod-agents/tools/verify_flow_slice.py"]
    }
  ]
}
