{
  "v": 1,
  "id": "mana-core-next-three-task-refinement-medium",
  "goal": "Refine the audited proposal into exactly three dependency-ordered Devstral Small tasks for gradient calculation, flow, and spherical gathering. Return valid JSON only with proposal_id and tasks. Each task must include id, title, objective, depends_on, allowed_files, forbidden_files, constraints, client_server_considerations, acceptance_criteria, files_to_inspect, suggested_write_roots, suggested_verifiers, and rationale. Fix the missing ChunkManaMap enumeration prerequisite by explicitly adding the smallest tested API extension or by accepting an explicit bounded work set. Use exact-file write roots. Do not require unsupported atomicity/thread safety; a server-tick-thread assumption is acceptable. Do not invent world bounds for Java ints. Use pure-Java verification while Gradle/Fabric infrastructure is absent. Do not duplicate completed behavior or edit approved design, assets, state, or pins.",
  "target": "initiatives/mc-mod-core",
  "model": {
    "profile": "mistral-medium-3.5",
    "capability": "planning",
    "importance": "high"
  },
  "context": [
    {"path": "AGENTS.md", "start": 39, "end": 105},
    {"path": "docs/PRODUCT.md", "start": 1, "end": 55},
    {"path": "docs/ARCHITECTURE.md", "start": 150, "end": 225},
    {"path": "mod-spec.json", "start": 1, "end": 63},
    {"path": ".mc-mod-agents/results/03c-mana-storage-devstral-tools.result.json", "start": 1, "end": 28},
    {"path": "src/main/java/com/manacore/core/storage/ChunkManaMap.java", "start": 1, "end": 213}
  ],
  "write_roots": [
    ".mc-mod-agents/results/05-next-three-task-refinement-medium.response.json"
  ],
  "done": [
    "The response contains exactly three sequential, internally implementable tasks with exact-file write roots.",
    "The flow task resolves the missing storage-enumeration capability without contradicting its allowed files.",
    "Concurrency, coordinate bounds, and verification requirements match the supplied pure-Java repository state."
  ],
  "forbidden": [
    "Do not propose edits to approved design, asset, ownership, approval, agent-state, or pinned-version files.",
    "Do not require APIs that neither exist nor are explicitly added within an allowed file.",
    "Do not use network access, repository tools, subagents, MCP, downloads, or package installation.",
    "Do not output prose outside the required JSON object."
  ],
  "limits": {
    "packet_chars": 30000,
    "output_chars": 20000,
    "model_context_tokens": 65536,
    "model_output_tokens": 8192,
    "model_timeout_seconds": 600,
    "max_tool_calls": 1,
    "max_verifiers": 0,
    "verifier_timeout_seconds": 30
  },
  "verifiers": []
}
